{
  "schemaVersion": "recognition-video-brief/v1",
  "characterId": "yi-agent-pipeline-test",
  "character": "一",
  "pinyin": "yi",
  "unitId": "unit-01",
  "duration": 7.8,
  "fps": 24,
  "teachingHook": "一条平平的小路，收成一个清清楚楚的一。",
  "narration": {
    "script": "一条小路。一个苹果。一根木棒。都是一。",
    "voice": "zh-CN-XiaoxiaoNeural",
    "cues": [
      {
        "at": 0.9,
        "text": "一条小路"
      },
      {
        "at": 2.55,
        "text": "一个苹果"
      },
      {
        "at": 4.35,
        "text": "一根木棒"
      },
      {
        "at": 6.55,
        "text": "都是一"
      }
    ]
  },
  "shotPlan": [
    {
      "id": "path-hook",
      "start": 0,
      "duration": 2.1,
      "purpose": "用横向小路建立一的字形方向。",
      "description": "暖色草地中出现一条平平的小路，兔子在路边用逐帧轻跳提醒孩子看横向。",
      "requiredAssets": [
        "meadow-path-plate",
        "rabbit-hop-agent-test"
      ]
    },
    {
      "id": "one-object",
      "start": 2.1,
      "duration": 1.65,
      "purpose": "用一个苹果连接数量意义。",
      "description": "一个苹果落下并轻轻回弹，停在横线附近，强调只有一个。",
      "requiredAssets": [
        "apple-settle-agent-test"
      ]
    },
    {
      "id": "shape-object",
      "start": 3.75,
      "duration": 1.75,
      "purpose": "让木棒滚平，连接物件形状和一横。",
      "description": "木棒用多帧滚动逐步放平，最后与横线方向一致。",
      "requiredAssets": [
        "stick-roll-flat-agent-test"
      ]
    },
    {
      "id": "glyph-close",
      "start": 5.35,
      "duration": 2.45,
      "purpose": "把生活画面收束到稳定汉字。",
      "description": "金色横线生长，大字一、pinyin 和短短记忆词安静出现。",
      "requiredAssets": [
        "html-glyph",
        "html-memory-line"
      ]
    }
  ],
  "teachingContract": {
    "sourceModel": "hongen-micro-lesson/v1",
    "meaningAction": {
      "shotId": "path-hook",
      "description": "先用小路和兔子轻跳建立横向语义场景，再收束到汉字一。",
      "mustPrecedeGlyphClosure": true
    },
    "glyphBinding": {
      "shotId": "shape-object",
      "description": "小路、木棒和金色横线都指向平平一横，让物件形状和字形绑定。",
      "boundElements": [
        "横向小路",
        "滚平木棒",
        "汉字一"
      ]
    },
    "phraseBridge": {
      "shotId": "glyph-close",
      "phrase": "都是一"
    },
    "sentenceBridge": {
      "sentence": "一条小路。一个苹果。一根木棒。都是一。",
      "source": "narration.script"
    },
    "recognitionPauses": [
      {
        "shotId": "path-hook",
        "target": "小路横向语义 cue",
        "seconds": 1.4
      },
      {
        "shotId": "glyph-close",
        "target": "最终大字和记忆词",
        "seconds": 2.2
      }
    ],
    "practiceOrRepeat": {
      "mode": "semantic-repeat",
      "description": "小路、苹果、木棒三次换物复现一，最后用都是一完成认字闭环。"
    },
    "writingPosition": "late-or-omitted",
    "mascotRole": "supporting"
  },
  "pacingRequirements": {
    "audienceAgeRange": "3-6",
    "minimumCueHoldSeconds": 1.4,
    "minimumFinalHoldSeconds": 2.2,
    "maximumSceneChangesPerSecond": 0.65,
    "productSurface": "P03 认字页竖屏手机教学舞台；孩子需要看清、听清、跟读，而不是快速看完演示。"
  },
  "animationRequirements": {
    "spriteRequired": [
      {
        "actor": "rabbit",
        "action": "hop",
        "reason": "兔子需要真实 pose 变化，不能只移动单张图。",
        "minFrames": 8,
        "requiredMotionParts": [
          "rear foot",
          "front foot",
          "ears",
          "body squash"
        ],
        "poseContract": [
          {
            "frame": 0,
            "pose": "crouch",
            "body": "身体压低变宽，重心在后脚上。",
            "limbs": [
              "后脚贴地向后压",
              "前脚贴地但准备抬起",
              "耳朵向后垂"
            ],
            "contact": "两只脚都接触地面。",
            "mustReadAs": "起跳前蓄力。"
          },
          {
            "frame": 1,
            "pose": "push-prep",
            "body": "身体开始抬起，胸口向前。",
            "limbs": [
              "后脚继续压地",
              "前脚微微离地",
              "耳朵开始滞后"
            ],
            "contact": "后脚仍接触地面，前脚轻抬。",
            "mustReadAs": "准备蹬地。"
          },
          {
            "frame": 2,
            "pose": "takeoff",
            "body": "身体离地，重心上升。",
            "limbs": [
              "后腿伸开",
              "前脚收向身体",
              "耳朵向后甩"
            ],
            "contact": "脚离开地面。",
            "mustReadAs": "蹬地起跳。"
          },
          {
            "frame": 3,
            "pose": "air-up",
            "body": "身体到达较高位置。",
            "limbs": [
              "后腿向后伸",
              "前脚收起",
              "耳朵明显滞后"
            ],
            "contact": "无脚接触地面。",
            "mustReadAs": "空中跳起。"
          },
          {
            "frame": 4,
            "pose": "air-peak",
            "body": "身体在最高点略拉长。",
            "limbs": [
              "后腿开始收回",
              "前脚仍收起",
              "耳朵追上身体"
            ],
            "contact": "无脚接触地面。",
            "mustReadAs": "跳到最高点。"
          },
          {
            "frame": 5,
            "pose": "landing-reach",
            "body": "身体下降，头部向前。",
            "limbs": [
              "后脚向下找地",
              "前脚伸向落点",
              "耳朵向前回摆"
            ],
            "contact": "脚即将落地。",
            "mustReadAs": "准备落地。"
          },
          {
            "frame": 6,
            "pose": "squash-landing",
            "body": "身体轻微压扁吸收落地。",
            "limbs": [
              "后脚重新贴地",
              "前脚贴地",
              "耳朵向前弹"
            ],
            "contact": "两只脚接触地面。",
            "mustReadAs": "落地压缩。"
          },
          {
            "frame": 7,
            "pose": "recover",
            "body": "身体回到站姿。",
            "limbs": [
              "后脚稳定",
              "前脚稳定",
              "耳朵回到自然角度"
            ],
            "contact": "两只脚稳定接触地面。",
            "mustReadAs": "跳完站稳。"
          }
        ]
      },
      {
        "actor": "apple",
        "action": "settle",
        "reason": "苹果落地和回弹需要形变帧。",
        "minFrames": 6,
        "requiredMotionParts": [
          "apple body",
          "stem",
          "leaf"
        ],
        "poseContract": [
          {
            "frame": 0,
            "pose": "fall-high",
            "body": "苹果从高处落下，形状略拉长。",
            "limbs": [
              "叶子随下落向上滞后"
            ],
            "contact": "未接触地面。",
            "mustReadAs": "一个苹果落下。"
          },
          {
            "frame": 1,
            "pose": "fall-mid",
            "body": "苹果继续下降。",
            "limbs": [
              "叶子轻微摆动"
            ],
            "contact": "未接触地面。",
            "mustReadAs": "正在落下。"
          },
          {
            "frame": 2,
            "pose": "touch",
            "body": "苹果刚接触地面，底部开始变宽。",
            "limbs": [
              "叶子向前摆"
            ],
            "contact": "底部接触地面。",
            "mustReadAs": "轻轻落地。"
          },
          {
            "frame": 3,
            "pose": "squash",
            "body": "苹果被压扁变宽。",
            "limbs": [
              "叶子压低"
            ],
            "contact": "底部充分接触地面。",
            "mustReadAs": "软软弹一下。"
          },
          {
            "frame": 4,
            "pose": "rebound",
            "body": "苹果回弹变高。",
            "limbs": [
              "叶子向上跟随"
            ],
            "contact": "轻微离地或减压。",
            "mustReadAs": "回弹。"
          },
          {
            "frame": 5,
            "pose": "settle",
            "body": "苹果恢复稳定圆润形状。",
            "limbs": [
              "叶子回到自然角度"
            ],
            "contact": "稳定停住。",
            "mustReadAs": "一个苹果停住。"
          }
        ]
      },
      {
        "actor": "stick",
        "action": "roll-flat",
        "reason": "木棒滚平是字形归纳动作，必须在帧内改变朝向。",
        "minFrames": 8,
        "requiredMotionParts": [
          "stick angle",
          "wood highlight"
        ],
        "poseContract": [
          {
            "frame": 0,
            "pose": "tilted-left",
            "body": "木棒左高右低，角度明显。",
            "limbs": [
              "高光随木棒倾斜"
            ],
            "contact": "一端靠近地面。",
            "mustReadAs": "木棒开始滚。"
          },
          {
            "frame": 1,
            "pose": "rolling-a",
            "body": "木棒角度变小。",
            "limbs": [
              "高光继续随角度转动"
            ],
            "contact": "接触点移动。",
            "mustReadAs": "正在滚动。"
          },
          {
            "frame": 2,
            "pose": "rolling-b",
            "body": "木棒继续接近横向。",
            "limbs": [
              "木纹位置变化"
            ],
            "contact": "接触点继续移动。",
            "mustReadAs": "滚向平平一横。"
          },
          {
            "frame": 3,
            "pose": "near-flat-a",
            "body": "木棒接近水平。",
            "limbs": [
              "高光接近水平"
            ],
            "contact": "大部分靠近横线方向。",
            "mustReadAs": "快要放平。"
          },
          {
            "frame": 4,
            "pose": "near-flat-b",
            "body": "木棒只剩微小角度。",
            "limbs": [
              "木纹稳定"
            ],
            "contact": "接触面变长。",
            "mustReadAs": "变成一横。"
          },
          {
            "frame": 5,
            "pose": "over-correct",
            "body": "木棒轻微越过水平。",
            "limbs": [
              "高光轻微越过"
            ],
            "contact": "接触面保持稳定。",
            "mustReadAs": "小小回弹。"
          },
          {
            "frame": 6,
            "pose": "flat",
            "body": "木棒水平停住。",
            "limbs": [
              "木纹水平"
            ],
            "contact": "平稳贴地。",
            "mustReadAs": "平平一横。"
          },
          {
            "frame": 7,
            "pose": "flat-hold",
            "body": "木棒保持水平。",
            "limbs": [
              "木纹不再滚动"
            ],
            "contact": "平稳贴地。",
            "mustReadAs": "稳定的一横。"
          }
        ]
      }
    ],
    "timelineOnly": [
      "background hold",
      "path highlight grow",
      "html text fade",
      "final card hold"
    ]
  },
  "finalFrame": {
    "description": "暖色草地和横线安静停住，汉字一、yi 和都是一清楚可读。",
    "mustBeReadableAsPoster": true
  }
}
